{
    "$schema": "https://json-schema.org/draft/2020-12/schema",
    "title": "Supplemental AgilePlus intent crosswalk",
    "type": "object",
    "additionalProperties": false,
    "required": [
        "schema_version",
        "record_type",
        "status",
        "base_revision",
        "authority_index",
        "source_catalog",
        "source_coverage",
        "mapping_policy",
        "canonical_inputs",
        "derived_counts",
        "mappings"
    ],
    "properties": {
        "schema_version": {
            "const": "1.0.0"
        },
        "record_type": {
            "const": "supplemental_intent_crosswalk"
        },
        "status": {
            "const": "proposed_source_reconciliation_not_authority"
        },
        "base_revision": {
            "type": "string",
            "pattern": "^[0-9a-f]{40}$"
        },
        "authority_index": {
            "const": "spec/product/AUTHORITY_INDEX.md"
        },
        "source_catalog": {
            "const": "spec/product/recovery-2026-10-14/OWNER_EXCERPTS.md"
        },
        "source_coverage": {
            "const": "selected_directly_supplied_excerpts_archive_unavailable_full_matrix_unverified"
        },
        "mapping_policy": {
            "type": "string",
            "minLength": 1
        },
        "canonical_inputs": {
            "type": "object",
            "additionalProperties": false,
            "required": ["requirements", "journeys", "oracles", "manifest"],
            "properties": {
                "requirements": {
                    "$ref": "#/$defs/input"
                },
                "journeys": {
                    "$ref": "#/$defs/input"
                },
                "oracles": {
                    "$ref": "#/$defs/input"
                },
                "manifest": {
                    "$ref": "#/$defs/input"
                }
            }
        },
        "derived_counts": {
            "type": "object",
            "additionalProperties": false,
            "required": ["requirements", "journeys", "oracles"],
            "properties": {
                "requirements": {
                    "type": "integer",
                    "minimum": 1
                },
                "journeys": {
                    "type": "integer",
                    "minimum": 1
                },
                "oracles": {
                    "type": "integer",
                    "minimum": 1
                }
            }
        },
        "mappings": {
            "type": "array",
            "minItems": 1,
            "items": {
                "$ref": "#/$defs/mapping"
            }
        }
    },
    "$defs": {
        "input": {
            "type": "object",
            "additionalProperties": false,
            "required": ["path", "sha256"],
            "properties": {
                "path": {
                    "type": "string",
                    "minLength": 1
                },
                "sha256": {
                    "type": "string",
                    "pattern": "^[0-9a-f]{64}$"
                }
            }
        },
        "mapping": {
            "type": "object",
            "additionalProperties": false,
            "required": [
                "requirement_id",
                "title",
                "source_refs",
                "mapping_basis",
                "intent_theme",
                "rationale",
                "journey_ids",
                "direct_oracle_ids",
                "journey_context_oracle_ids",
                "runtime_status"
            ],
            "properties": {
                "requirement_id": {
                    "type": "string",
                    "pattern": "^AP-R-[A-Z0-9-]+$"
                },
                "title": {
                    "type": "string",
                    "minLength": 1
                },
                "source_refs": {
                    "type": "array",
                    "minItems": 1,
                    "uniqueItems": true,
                    "items": {
                        "enum": [
                            "S01",
                            "S02",
                            "S03",
                            "S04",
                            "S05",
                            "S06",
                            "S07",
                            "S08",
                            "S09"
                        ]
                    }
                },
                "mapping_basis": {
                    "enum": ["intent_theme", "inherited_contract"]
                },
                "intent_theme": {
                    "type": "string",
                    "minLength": 1
                },
                "rationale": {
                    "type": "string",
                    "minLength": 1
                },
                "journey_ids": {
                    "type": "array",
                    "minItems": 1,
                    "uniqueItems": true,
                    "items": {
                        "type": "string",
                        "pattern": "^AP-J-[0-9]+$"
                    }
                },
                "direct_oracle_ids": {
                    "type": "array",
                    "minItems": 1,
                    "uniqueItems": true,
                    "items": {
                        "type": "string",
                        "pattern": "^AP-(RVC|VC)-[0-9]+$"
                    }
                },
                "journey_context_oracle_ids": {
                    "type": "array",
                    "uniqueItems": true,
                    "items": {
                        "type": "string",
                        "pattern": "^AP-(RVC|VC)-[0-9]+$"
                    }
                },
                "runtime_status": {
                    "const": "not_assessed"
                }
            }
        }
    }
}
