{
    "schema_version": "1.0.0",
    "record_type": "supplemental_intent_crosswalk",
    "status": "proposed_source_reconciliation_not_authority",
    "base_revision": "45bb5c9fde4d15ee698f42a6e5f9304aae336ff5",
    "authority_index": "spec/product/AUTHORITY_INDEX.md",
    "source_catalog": "spec/product/recovery-2026-10-14/OWNER_EXCERPTS.md",
    "source_coverage": "selected_directly_supplied_excerpts_archive_unavailable_full_matrix_unverified",
    "mapping_policy": "intent_theme connects broad owner intent; inherited_contract retains accepted details without claiming verbatim owner derivation. Journey-context oracles are not direct requirement witnesses. No runtime verdict is inferred.",
    "canonical_inputs": {
        "requirements": {
            "path": "spec/product/requirements.semantic.v1.json",
            "sha256": "5624abc25088351bd23ba9595ab12501aabe218708c9a3e8e2c33e91e8c835d1"
        },
        "journeys": {
            "path": "spec/product/journeys.v1.json",
            "sha256": "f67993e36868a6c5e15b3c0fc1c59f8a90712d0ba0e04ca507accdf5c1e53c0b"
        },
        "oracles": {
            "path": "verification/semantic-verification-cases.v1.json",
            "sha256": "020b63be34005b671a20bc28528d4182e121ab136981434d815afa78ef2cf83c"
        },
        "manifest": {
            "path": "spec/product/mature-contract.v1.json",
            "sha256": "e460016dc2414e019720a0fff6a552a3b82975d263f30c9337388da4c8075cbf"
        }
    },
    "derived_counts": {
        "requirements": 67,
        "journeys": 12,
        "oracles": 92
    },
    "mappings": [
        {
            "requirement_id": "AP-R-DEV-ID",
            "title": "Durable development identity",
            "source_refs": ["S02", "S03", "S04"],
            "mapping_basis": "inherited_contract",
            "intent_theme": "Stable identities and traceability",
            "rationale": "Cross-linked product views and traceability-first assignments motivate durable links. This row inherits the exact work identity/history semantics rather than importing product identity into AgilePlus.",
            "journey_ids": ["AP-J-01"],
            "direct_oracle_ids": ["AP-RVC-040"],
            "journey_context_oracle_ids": ["AP-VC-001", "AP-VC-002"],
            "runtime_status": "not_assessed"
        },
        {
            "requirement_id": "AP-R-SPEC-REV",
            "title": "Immutable accepted specification revisions",
            "source_refs": ["S04"],
            "mapping_basis": "intent_theme",
            "intent_theme": "Adaptive methodology and accepted specification",
            "rationale": "S04 supports adaptive methodology synthesis and rigorous specification. Canonical semantics determine the exact obligation and authority; source import cannot create competing accepted intent.",
            "journey_ids": ["AP-J-01"],
            "direct_oracle_ids": ["AP-RVC-041"],
            "journey_context_oracle_ids": ["AP-VC-001", "AP-VC-002"],
            "runtime_status": "not_assessed"
        },
        {
            "requirement_id": "AP-R-AMBIGUITY",
            "title": "Material ambiguity blocks acceptance",
            "source_refs": ["S04"],
            "mapping_basis": "intent_theme",
            "intent_theme": "Adaptive methodology and accepted specification",
            "rationale": "S04 supports adaptive methodology synthesis and rigorous specification. Canonical semantics determine the exact obligation and authority; source import cannot create competing accepted intent.",
            "journey_ids": ["AP-J-01"],
            "direct_oracle_ids": ["AP-RVC-042"],
            "journey_context_oracle_ids": ["AP-VC-001", "AP-VC-002"],
            "runtime_status": "not_assessed"
        },
        {
            "requirement_id": "AP-R-ARTIFACT-ROLE",
            "title": "Framework-neutral artifact authority",
            "source_refs": ["S04"],
            "mapping_basis": "intent_theme",
            "intent_theme": "Adaptive methodology and accepted specification",
            "rationale": "S04 supports adaptive methodology synthesis and rigorous specification. Canonical semantics determine the exact obligation and authority; source import cannot create competing accepted intent.",
            "journey_ids": ["AP-J-01"],
            "direct_oracle_ids": ["AP-RVC-043"],
            "journey_context_oracle_ids": ["AP-VC-001", "AP-VC-002"],
            "runtime_status": "not_assessed"
        },
        {
            "requirement_id": "AP-R-WP-DAG",
            "title": "Dependency-aware durable work packages",
            "source_refs": ["S04"],
            "mapping_basis": "inherited_contract",
            "intent_theme": "Rigorous bounded assignments and independent acceptance",
            "rationale": "The detailed obligation is inherited from the accepted canonical contract; S04 supplies the broader assignment/autograder motivation, not a literal statement of this behavior.",
            "journey_ids": ["AP-J-02"],
            "direct_oracle_ids": ["AP-RVC-044"],
            "journey_context_oracle_ids": ["AP-VC-003", "AP-VC-004"],
            "runtime_status": "not_assessed"
        },
        {
            "requirement_id": "AP-R-ASSIGNMENT",
            "title": "Frozen executable assignment",
            "source_refs": ["S04"],
            "mapping_basis": "inherited_contract",
            "intent_theme": "Rigorous bounded assignments and independent acceptance",
            "rationale": "The detailed obligation is inherited from the accepted canonical contract; S04 supplies the broader assignment/autograder motivation, not a literal statement of this behavior.",
            "journey_ids": ["AP-J-02"],
            "direct_oracle_ids": ["AP-RVC-045"],
            "journey_context_oracle_ids": ["AP-VC-003", "AP-VC-004"],
            "runtime_status": "not_assessed"
        },
        {
            "requirement_id": "AP-R-CRITERIA-NONEMPTY",
            "title": "No vacuous assignment acceptance",
            "source_refs": ["S04"],
            "mapping_basis": "inherited_contract",
            "intent_theme": "Rigorous bounded assignments and independent acceptance",
            "rationale": "The detailed obligation is inherited from the accepted canonical contract; S04 supplies the broader assignment/autograder motivation, not a literal statement of this behavior.",
            "journey_ids": ["AP-J-02"],
            "direct_oracle_ids": ["AP-RVC-046"],
            "journey_context_oracle_ids": ["AP-VC-003", "AP-VC-004"],
            "runtime_status": "not_assessed"
        },
        {
            "requirement_id": "AP-R-CONTEXT",
            "title": "Bounded provenance-bearing context bundle",
            "source_refs": ["S04", "S05", "S07", "S08"],
            "mapping_basis": "inherited_contract",
            "intent_theme": "Provenance-bearing scenario and experiment inputs",
            "rationale": "Scenario and research inputs motivate explicit assumptions, baselines and reproducible evaluation context. Detailed evidence/configuration obligations remain inherited; simulation integration is proposed.",
            "journey_ids": ["AP-J-02"],
            "direct_oracle_ids": ["AP-RVC-047"],
            "journey_context_oracle_ids": ["AP-VC-003", "AP-VC-004"],
            "runtime_status": "not_assessed"
        },
        {
            "requirement_id": "AP-R-ATTEMPT-ID",
            "title": "Replaceable execution attempts",
            "source_refs": ["S04"],
            "mapping_basis": "inherited_contract",
            "intent_theme": "Rigorous bounded assignments and independent acceptance",
            "rationale": "The detailed obligation is inherited from the accepted canonical contract; S04 supplies the broader assignment/autograder motivation, not a literal statement of this behavior.",
            "journey_ids": ["AP-J-03"],
            "direct_oracle_ids": ["AP-RVC-048"],
            "journey_context_oracle_ids": [
                "AP-VC-005",
                "AP-VC-006",
                "AP-VC-007"
            ],
            "runtime_status": "not_assessed"
        },
        {
            "requirement_id": "AP-R-CLAIM",
            "title": "Temporary explicit execution authority",
            "source_refs": ["S04"],
            "mapping_basis": "inherited_contract",
            "intent_theme": "Rigorous bounded assignments and independent acceptance",
            "rationale": "The detailed obligation is inherited from the accepted canonical contract; S04 supplies the broader assignment/autograder motivation, not a literal statement of this behavior.",
            "journey_ids": ["AP-J-03"],
            "direct_oracle_ids": ["AP-RVC-049"],
            "journey_context_oracle_ids": [
                "AP-VC-005",
                "AP-VC-006",
                "AP-VC-007"
            ],
            "runtime_status": "not_assessed"
        },
        {
            "requirement_id": "AP-R-CLAIM-NOINHERIT",
            "title": "Authority is not inherited by replacement",
            "source_refs": ["S04"],
            "mapping_basis": "inherited_contract",
            "intent_theme": "Rigorous bounded assignments and independent acceptance",
            "rationale": "The detailed obligation is inherited from the accepted canonical contract; S04 supplies the broader assignment/autograder motivation, not a literal statement of this behavior.",
            "journey_ids": ["AP-J-03"],
            "direct_oracle_ids": ["AP-RVC-050"],
            "journey_context_oracle_ids": [
                "AP-VC-005",
                "AP-VC-006",
                "AP-VC-007"
            ],
            "runtime_status": "not_assessed"
        },
        {
            "requirement_id": "AP-R-ISOLATION",
            "title": "Execution isolation is explicit",
            "source_refs": ["S04"],
            "mapping_basis": "inherited_contract",